{
  "status": "success",
  "output": {
    "summary": {
      "total_accounts": 100,
      "by_stage": {
        "customer": 18,
        "mql": 23,
        "lead": 30,
        "opportunity": 9,
        "subscriber": 3,
        "sql": 12,
        "evangelist": 5
      },
      "health_score": 0.46
    },
    "bottlenecks": [],
    "at_risk": [
      {
        "email": "user25@example.com",
        "name": "User 25",
        "company": "Enterprise Inc",
        "stage": "customer",
        "risk_score": 0.8,
        "risk_factors": {
          "days_inactive": 51,
          "negative_trend": true
        }
      },
      {
        "email": "user44@example.com",
        "name": "User 44",
        "company": "BigBrand",
        "stage": "customer",
        "risk_score": 0.8,
        "risk_factors": {
          "days_inactive": 37,
          "negative_trend": true
        }
      },
      {
        "email": "user71@example.com",
        "name": "User 71",
        "company": "Enterprise Inc",
        "stage": "customer",
        "risk_score": 0.8,
        "risk_factors": {
          "days_inactive": 44,
          "negative_trend": true
        }
      },
      {
        "email": "user10@example.com",
        "name": "User 10",
        "company": "StartupX",
        "stage": "customer",
        "risk_score": 0.6,
        "risk_factors": {
          "days_inactive": 35,
          "negative_trend": false
        }
      },
      {
        "email": "user42@example.com",
        "name": "User 42",
        "company": "Acme Corp",
        "stage": "customer",
        "risk_score": 0.6,
        "risk_factors": {
          "days_inactive": 43,
          "negative_trend": false
        }
      },
      {
        "email": "user48@example.com",
        "name": "User 48",
        "company": "TechCo",
        "stage": "customer",
        "risk_score": 0.6,
        "risk_factors": {
          "days_inactive": 53,
          "negative_trend": false
        }
      },
      {
        "email": "user64@example.com",
        "name": "User 64",
        "company": "BigBrand",
        "stage": "customer",
        "risk_score": 0.6,
        "risk_factors": {
          "days_inactive": 33,
          "negative_trend": false
        }
      }
    ],
    "upsell_candidates": [
      {
        "email": "user28@example.com",
        "name": "User 28",
        "company": "TechCo",
        "stage": "customer",
        "upsell_score": 0.7,
        "upsell_signals": {
          "highly_active": true,
          "growing_usage": true,
          "high_adoption": false
        }
      }
    ],
    "recommendations": [
      {
        "priority": "high",
        "category": "retention",
        "action": "Launch re-engagement campaign for 7 at-risk accounts",
        "context": "Average risk score: 69%",
        "impact": "Potential save of 7 accounts",
        "suggested_tactics": [
          "Personal outreach from CSM",
          "Offer exclusive content or training",
          "Review product friction points"
        ]
      },
      {
        "priority": "medium",
        "category": "expansion",
        "action": "Target 1 high-potential accounts for upsell",
        "context": "Average upsell score: 70%",
        "impact": "Potential revenue expansion",
        "suggested_tactics": [
          "Introduce premium features",
          "Offer enterprise tier upgrade",
          "Schedule QBR with success metrics"
        ]
      }
    ],
    "conversions": [
      {
        "from_stage": "subscriber",
        "to_stage": "lead",
        "from_count": 3,
        "to_count": 30,
        "rate": 10.0,
        "benchmark": 0.4
      },
      {
        "from_stage": "lead",
        "to_stage": "mql",
        "from_count": 30,
        "to_count": 23,
        "rate": 0.767,
        "benchmark": 0.3
      },
      {
        "from_stage": "mql",
        "to_stage": "sql",
        "from_count": 23,
        "to_count": 12,
        "rate": 0.522,
        "benchmark": 0.25
      },
      {
        "from_stage": "sql",
        "to_stage": "opportunity",
        "from_count": 12,
        "to_count": 9,
        "rate": 0.75,
        "benchmark": 0.35
      },
      {
        "from_stage": "opportunity",
        "to_stage": "customer",
        "from_count": 9,
        "to_count": 18,
        "rate": 2.0,
        "benchmark": 0.2
      },
      {
        "from_stage": "customer",
        "to_stage": "evangelist",
        "from_count": 18,
        "to_count": 5,
        "rate": 0.278,
        "benchmark": 0.25
      }
    ],
    "_meta": {
      "tenant_id": "B0bCCLkqvFhK7JCWKNR1",
      "run_id": "805bd620",
      "execution_mode": "suggest",
      "runtime_seconds": 3.55,
      "cost_usd": 0.0,
      "release_action": "auto_refine",
      "skill_version": "v2.0.0",
      "data_quality": {
        "records_processed": 100,
        "records_skipped": 0,
        "field_coverage": {
          "email": 1.0,
          "company": 1.0,
          "lifecyclestage": 1.0
        },
        "issues": [],
        "warnings": []
      },
      "tokens": {
        "input": 0,
        "output": 0,
        "total": 0
      },
      "sub_calls": 0,
      "timestamp": "2026-01-30T02:31:14.655536+00:00",
      "intelligence": {
        "enabled": true,
        "prediction_id": "d732f430-28c",
        "guidance_confidence": 0.3
      }
    }
  },
  "evaluation": {
    "score": 0.72,
    "pass": false,
    "breakdown": {
      "schema_validity": 1.0,
      "factuality": 0,
      "completeness": 0.7,
      "brand_voice": 1.0,
      "risk_flags": 1.0,
      "context_efficiency": 1.0
    },
    "issues": [
      {
        "dimension": "factuality",
        "severity": "high",
        "description": "Found 2 factual claims but only 0 have sources",
        "location": "various"
      },
      {
        "dimension": "completeness",
        "severity": "medium",
        "description": "Missing required section: summary",
        "location": "root"
      },
      {
        "dimension": "completeness",
        "severity": "medium",
        "description": "Missing required section: recommendations",
        "location": "root"
      }
    ],
    "suggestions": [
      "Add source references for factual claims (e.g., '[source: HubSpot data]')"
    ],
    "release_action": "auto_refine",
    "release_message": "Output needs improvement. Applying suggestions and retrying."
  },
  "release_action": "auto_refine",
  "release_message": "Output needs improvement. Applying suggestions and retrying.",
  "run_id": "28f5bbca",
  "run_dir": "/Users/jflo7006/Downloads/Marketerhire/mh1-hq/workflows/runs/2026-01-29/28f5bbca"
}