{
  "status": "success",
  "output": {
    "summary": {
      "total_accounts": 100,
      "by_stage": {
        "lead": 28,
        "customer": 22,
        "subscriber": 9,
        "sql": 15,
        "mql": 16,
        "opportunity": 6,
        "evangelist": 4
      },
      "health_score": 0.48
    },
    "bottlenecks": [],
    "at_risk": [
      {
        "email": "user42@example.com",
        "name": "User 42",
        "company": "BigBrand",
        "stage": "customer",
        "risk_score": 0.8,
        "risk_factors": {
          "days_inactive": 59,
          "negative_trend": true
        }
      },
      {
        "email": "user46@example.com",
        "name": "User 46",
        "company": "BigBrand",
        "stage": "customer",
        "risk_score": 0.8,
        "risk_factors": {
          "days_inactive": 52,
          "negative_trend": true
        }
      },
      {
        "email": "user97@example.com",
        "name": "User 97",
        "company": "Acme Corp",
        "stage": "customer",
        "risk_score": 0.8,
        "risk_factors": {
          "days_inactive": 38,
          "negative_trend": true
        }
      },
      {
        "email": "user55@example.com",
        "name": "User 55",
        "company": "StartupX",
        "stage": "customer",
        "risk_score": 0.6,
        "risk_factors": {
          "days_inactive": 39,
          "negative_trend": false
        }
      },
      {
        "email": "user59@example.com",
        "name": "User 59",
        "company": "BigBrand",
        "stage": "customer",
        "risk_score": 0.6,
        "risk_factors": {
          "days_inactive": 31,
          "negative_trend": false
        }
      },
      {
        "email": "user73@example.com",
        "name": "User 73",
        "company": "Acme Corp",
        "stage": "customer",
        "risk_score": 0.6,
        "risk_factors": {
          "days_inactive": 37,
          "negative_trend": false
        }
      },
      {
        "email": "user79@example.com",
        "name": "User 79",
        "company": "StartupX",
        "stage": "customer",
        "risk_score": 0.6,
        "risk_factors": {
          "days_inactive": 40,
          "negative_trend": false
        }
      },
      {
        "email": "user80@example.com",
        "name": "User 80",
        "company": "StartupX",
        "stage": "customer",
        "risk_score": 0.6,
        "risk_factors": {
          "days_inactive": 42,
          "negative_trend": false
        }
      }
    ],
    "upsell_candidates": [],
    "recommendations": [
      {
        "priority": "high",
        "category": "retention",
        "action": "Launch re-engagement campaign for 8 at-risk accounts",
        "context": "Average risk score: 68%",
        "impact": "Potential save of 8 accounts",
        "suggested_tactics": [
          "Personal outreach from CSM",
          "Offer exclusive content or training",
          "Review product friction points"
        ]
      }
    ],
    "conversions": [
      {
        "from_stage": "subscriber",
        "to_stage": "lead",
        "from_count": 9,
        "to_count": 28,
        "rate": 3.111,
        "benchmark": 0.4
      },
      {
        "from_stage": "lead",
        "to_stage": "mql",
        "from_count": 28,
        "to_count": 16,
        "rate": 0.571,
        "benchmark": 0.3
      },
      {
        "from_stage": "mql",
        "to_stage": "sql",
        "from_count": 16,
        "to_count": 15,
        "rate": 0.938,
        "benchmark": 0.25
      },
      {
        "from_stage": "sql",
        "to_stage": "opportunity",
        "from_count": 15,
        "to_count": 6,
        "rate": 0.4,
        "benchmark": 0.35
      },
      {
        "from_stage": "opportunity",
        "to_stage": "customer",
        "from_count": 6,
        "to_count": 22,
        "rate": 3.667,
        "benchmark": 0.2
      },
      {
        "from_stage": "customer",
        "to_stage": "evangelist",
        "from_count": 22,
        "to_count": 4,
        "rate": 0.182,
        "benchmark": 0.25
      }
    ],
    "_meta": {
      "tenant_id": "acme_corp",
      "run_id": "<RUN_ID>",
      "execution_mode": "suggest",
      "runtime_seconds": "<RUNTIME>",
      "cost_usd": 0.0,
      "release_action": "auto_refine",
      "skill_version": "v2.0.0",
      "data_quality": {
        "records_processed": 100,
        "records_skipped": 0,
        "field_coverage": {
          "email": 1.0,
          "company": 1.0,
          "lifecyclestage": 1.0
        },
        "issues": [],
        "warnings": []
      },
      "tokens": {
        "input": "<TOKEN_COUNT>",
        "output": "<TOKEN_COUNT>",
        "total": "<TOKEN_COUNT>"
      },
      "sub_calls": 0,
      "timestamp": "<TIMESTAMP>",
      "intelligence": {
        "enabled": false,
        "prediction_id": null,
        "guidance_confidence": null
      }
    }
  },
  "evaluation": {
    "score": 0.72,
    "pass": false,
    "breakdown": {
      "schema_validity": 1.0,
      "factuality": 0,
      "completeness": 0.7,
      "brand_voice": 1.0,
      "risk_flags": 1.0,
      "context_efficiency": 1.0
    },
    "issues": [
      {
        "dimension": "factuality",
        "severity": "high",
        "description": "Found 1 factual claims but only 0 have sources",
        "location": "various"
      },
      {
        "dimension": "completeness",
        "severity": "medium",
        "description": "Missing required section: summary",
        "location": "root"
      },
      {
        "dimension": "completeness",
        "severity": "medium",
        "description": "Missing required section: recommendations",
        "location": "root"
      }
    ],
    "suggestions": [
      "Add source references for factual claims (e.g., '[source: HubSpot data]')"
    ],
    "release_action": "auto_refine",
    "release_message": "Output needs improvement. Applying suggestions and retrying."
  },
  "release_action": "auto_refine",
  "release_message": "Output needs improvement. Applying suggestions and retrying.",
  "run_id": "<RUN_ID>",
  "run_dir": "<RUN_DIR>"
}